id;code;name;dpto_code;unit;current_stock;cost_max;photo_url;dpto_id;show;orden;cost_oferta;cost_mayor;cost_min;checked
4281;GA002-01;SOCATE LATERAL ORIGINAL DODGE BOMBILLO 158;AUTO.90;PZA;0;3.107;GA002-01.jpg;96;t;1;0;0;0;f
4282;GA002-02;CONECTOR ELECTRO VENTILADOR G.M. CENTUR (SQ-273=025);AUTO.90;PZA;140;2.517;GA002-02.jpg;96;t;1;0;0;0;f
4283;GA002-03;GAH02-07...CONECTOR LUZ FLASHER 2 VIAS;AUTO.90;PZA;0;0;GA002-03.jpg;96;t;1;0;0;0;f
4284;GA002-04;SOCATE UNIVERSAL METAL PINZA 2 CONTACTO;AUTO.90;PZA;-7;0.8;GA002-04.jpg;96;t;1;0;0.523;0;f
4285;GA002-05;SOCATE DE COCUYO DE CHEVETTE;AUTO.90;PZA;0;0;GA002-05.jpg;96;t;1;0;0;0;f
4286;GA002-06;SOCATE PLANO-BANDERA DE GENERAL MOTOR 1 CONTACTO;AUTO.90;PZA;19;5.31;GA002-06.jpg;96;t;1;0;0;0;f
4287;GA002-07;CONECTOR GOMA MACHO HEMBRA 2 VIAS MAGNETO;AUTO.90;PAR;0;2;GA002-07.jpg;96;t;1;0;0;0;f
4288;GA002-08;CONECTOR REGULADOR CHEVROLET AWG 14;AUTO.90;PZA;30;1.92;GA002-08.jpg;96;t;1;0;0;0;f
4289;GA002-085;SOCATE PLASTICO UNIVERSAL BOMBILLO 1073 1 CONTACTO ( A131016-52);AUTO.90;PZA;5;0.89;GA002-085.jpg;96;t;1;0;0;0;f
4290;GA002-086;SOCATE BOMBILLO 9005-9006-9012 PLASTICO (A-CONE-9012;AUTO.90;PZA;50;4.785;GA002-086.jpg;96;t;1;0;0;0;f
4291;GA002-087;SOCATE BOMBILLO PSX24W-H16 PLASTICO (A-CONE-H16);AUTO.90;PZA;73;4.027;GA002-087.jpg;96;t;1;0;0;0;f
4292;GA002-088;&&&&& GA004-022;AUTO.90;PZA;0;2.013;GA002-088.jpg;96;t;1;0;1.867;0;f
4293;GA002-089;SOCATE BOMBILLO 1073(1156) SQ-2000 (2);AUTO.90;PZA;1;1.773;GA002-089.jpg;96;t;1;0;0;0;f
4294;GA002-09;CONECTOR BOBINA DE FORD;AUTO.90;PZA;14;3.232;GA002-09.jpg;96;t;1;0;0;0;f
4295;GA002-090;CONECTOR VALVULA RETROCESO SQ926 (2);AUTO.90;PZA;0;1.165;GA002-090.jpg;96;t;1;0;0;0;f
4296;GA002-091;CONECTOR VALVULA MOTOR VENTILA 96A-F1A (2);AUTO.90;PZA;0;1.88;GA002-091.jpg;96;t;1;0;0;0;f
4297;GA002-092;CONECTOR ALTERN MITSUBISHI KIA FESTIVA BOBINA NISSAN TIPO PISTOLA LH;AUTO.90;PZA;2;1.053;GA002-092.jpg;96;t;1;0;0.88;0;f
4298;GA002-093;CONECTOR BOMBA GAS UNIVERSAL SQ1089 (2);AUTO.90;PZA;3;2.307;GA002-093.jpg;96;t;1;0;0;0;f
4299;GA002-094;CONECTOR BOBINA CHEVROLET SPARK 55A-F1 (2);AUTO.90;PZA;137;3.605;GA002-094.jpg;96;t;1;0;1.64;0;f
4300;GA002-095;SOCATE UNIVERSAL 2CONTCTO PA SQ-1006-2C (2);AUTO.90;PZA;5;1.373;GA002-095.jpg;96;t;1;0;0;0;f
4301;GA002-096;CONECTOR SENSOR DE TEMPERATURA AIRE AMBIENTE HYUNDAI KIA;AUTO.90;PZA;383;1.693;GA002-096.jpg;96;t;1;0;1.467;0;f
4302;GA002-097;CONECTOR ARNES UNIVERSAL TRAILER 3 PINES;AUTO.90;PZA;185;3.517;GA002-097.jpg;96;t;1;0;0.973;0;f
4303;GA002-098;SOCATE METAL UNIVERSAL 2 CONTA 12141-F1R (2);AUTO.90;PZA;5;1.453;GA002-098.jpg;96;t;1;0;0;0;f
4304;GA002-099;CONECTOR DE BOBINA HYUNDAI GETZ ELANTRA IZQUIERDO;AUTO.90;PZA;5;1.867;GA002-099.jpg;96;t;1;0;0;0;f
4305;GA002-10;CONECTOR REGULADOR DE CHEVROLET AWG 18;AUTO.90;PZA;-30;0.84;GA002-08.jpg;96;t;1;0;0;0;f
4306;GA002-100;CONECTOR VALVULA REVERSO TIPO F1R-2319 (2);AUTO.90;PZA;0;2.307;GA002-100.jpg;96;t;1;0;0;0;f
4307;GA002-101;SOCATE BOMBILLO158 PARA FAROS SQ-165 (2);AUTO.90;PZA;4;0.817;GA002-101.jpg;96;t;1;0;0.681;0;f
4308;GA002-102;CONECTOR ELECTROVENTILADOR YR SQ-346 (2);AUTO.90;PZA;0;2.805;GA002-102.jpg;96;t;1;0;0;0;f
4309;GA002-103;SOCATE BOMBILLO H10 SQ-581 (2);AUTO.90;PZA;190;3.813;GA002-103.jpg;96;t;1;0;0;0;f
4310;GA002-104;CONECTOR VALVULA TEMPERATURA FORD EXPLORER RANGER FIESTA KA;AUTO.90;PZA;0;2.04;GA002-104.jpg;96;t;1;0;0;0;f
4311;GA002-106;SOCATE BOMBILLO SQ582 (2);AUTO.90;PZA;0;2.84;GA002-106.jpg;96;t;1;0;0;0;f
4312;GA002-107;SOCATE DOBLE BOMBILLO 158 CON CONECTOR;AUTO.90;PZA;0;2.453;GA002-107.jpg;96;t;1;0;0;0;f
4313;GA002-108;SOCATE BOMBILLO 880.881.889 SQ-539 (2);AUTO.90;PZA;1;1.253;GA002-108.jpg;96;t;1;0;0;0;f
4314;GA002-109;SOCATE STOP BOMBILLO 7440 SIMP SQ-169 (2);AUTO.90;PZA;126;2.307;GA002-109.jpg;96;t;1;0;2.067;0;f
4315;GA002-11;SOCATE LUZ LATERAL BOMBILLO 158 GM CHEV;AUTO.90;PZA;1865;1.973;GA002-11.jpg;96;t;1;0;0.76;0.599;f
4316;GA002-110;SOCATE BOMBILLO E SQ1900 (2);AUTO.90;PZA;20;1.373;GA002-110.jpg;96;t;1;0;0;0;f
4317;GA002-111;SOCATE LUZ PLACA UNIVERSAL BOMBILLO 158 F1R-154 (2);AUTO.90;PZA;10;1.867;GA002-111.jpg;96;t;1;0;0;0;f
4318;GA002-112;CONECTOR INYECTOR TBI GM BLEZER SQ-292 (2);AUTO.90;PZA;5;3.027;GA002-112.jpg;96;t;1;0;0;0;f
4319;GA002-113;CONECTOR CARBURADOR 2T4 BOCA SQ-306 (2);AUTO.90;PZA;10;2.585;GA002-113.jpg;96;t;1;0;0;0;f
4320;GA002-114;CONECTOR BOMBA GAS ELECTRICA SQ-499 (2);AUTO.90;PZA;0;2.307;GA002-114.jpg;96;t;1;0;0;0;f
4321;GA002-115;CONECTOR LAMPARE LED 2 ENTRADA SQ921 (2);AUTO.90;PZA;1;2.973;GA002-115.jpg;96;t;1;0;0;0;f
4322;GA002-116;CONECTOR ARNES UNIVERSAL2 F1R-915 (2);AUTO.90;PZA;5;2.973;GA002-116.jpg;96;t;1;0;0;0;f
4323;GA002-117;CONECTOR MOTOR ELECTROVENTILADOR SQ-468 (2);AUTO.90;PZA;10;2.6;GA002-117.jpg;96;t;1;0;0;0;f
4324;GA002-118;CONECTOR VALVULA DE TEMPERATURA SQ-1089 (2);AUTO.90;PZA;0;3.027;GA002-118.jpg;96;t;1;0;0;0;f
4325;GA002-119;SOCATE METAL 2 CONTACTOS F1R-1236 (2);AUTO.90;PZA;5;1.107;GA002-119.jpg;96;t;1;0;0;0;f
4326;GA002-12;SOCATE G.M. PARA BOMBILLO 1073;AUTO.90;PZA;0;2.384;GA002-12.jpg;96;t;1;0;0;0;f
4327;GA002-120;CONECTOR BOMBA GASOLINA ELECTR X719ND (2);AUTO.90;PZA;19;2.347;GA002-120.jpg;96;t;1;0;0;0;f
4328;GA002-121;SOCATE BOMBILLO FARO LUZ CRUCE SQ-1127 (2);AUTO.90;PZA;5;2.307;GA002-121.jpg;96;t;1;0;0;0;f
4329;GA002-122;CONECTOR ALTERN MITSUBISHI KIA FESTIVA BOBINA NISSAN TIPO PISTOLA LM;AUTO.90;PZA;-2;2.48;GA002-122.jpg;96;t;1;0;0;0;f
4330;GA002-123;SOCATE STOP Y CRUCE 2C FORD MO SQ-216 (2);AUTO.90;PZA;3;0.667;GA002-123.jpg;96;t;1;0;0;0;f
4331;GA002-124;CONECTO ALT MITSUBISHI VARIOS SQ-1338 (2);AUTO.90;PZA;0;2.079;GA002-124.jpg;96;t;1;0;0;0;f
4332;GA002-125;CONECTOR MOTOR VENTILADOR 59A-F1 (2);AUTO.90;PZA;0;3.707;GA002-125.jpg;96;t;1;0;0;0;f
4333;GA002-126;SOCATE FARO LUZ CRUCE CARROS A SQ-241 (2);AUTO.90;PZA;134;2.413;GA002-126.jpg;96;t;1;0;2.413;0;f
4334;GA002-127;CONECTOR DISTRIBUIDOR TOYOTA ARAYA COROLLA AVILA;AUTO.90;PZA;0;1.69;GA002-127.jpg;96;t;1;0;1.47;0;f
4335;GA002-128;SOCATE STOP 2C UNIV METAL TIPO SQ-112 (2);AUTO.90;PZA;0;1.947;GA002-128.jpg;96;t;1;0;0;0;f
4336;GA002-129;SOCATE METAL UNIVERSAL 2CONTA SQ-2101 (2);AUTO.90;PZA;0;0.96;GA002-129.jpg;96;t;1;0;0;0;f
4337;GA002-13;SOCATE FORD PARA BOMBILLO 1073;AUTO.90;PZA;4;2.373;GA002-13.jpg;96;t;1;0;0;0;f
4338;GA002-130;INACTIVO..........SOCATE STOP BOMBILLO 3156 1CONTACTO;AUTO.90;PZA;0;0;GA002-130.jpg;96;t;1;0;0;0;f
4339;GA002-131;GAH02-.....CONECTOR SENSOR MASA FLUJO MASA AIR SQ-1804 (2);AUTO.90;PZA;5;0.999;GA002-131.jpg;96;t;1;0;0;0;f
4340;GA002-132;CONECTOR SENSOR ABS TRASERO CHEVROLET CAPTIVA;AUTO.90;PZA;109;1.6;GA002-132.jpg;96;t;1;0;1.413;0;f
4341;GA002-133;PORTA FUSIBLE AT DE GOMA CABLE 16;AUTO.90;PZA;0;1.453;GA002-133.jpg;96;t;1;0;1.28;0;f
4342;GA002-134;CONECTOR INYECTOR FORD EXPLORER / TRITON/ FX4/FORTALEZA/NEON;AUTO.90;PZA;10;4.173;GA002-134.jpg;96;t;1;0;0;0;f
4343;GA002-135;CONECTOR SENSOR VELOCIDAD ABS HONDA TOYOTA TOYOTA CAMRY;AUTO.90;PZA;129;1.053;GA002-135.jpg;96;t;1;0;0.88;0;f
4344;GA002-136;CONECTOR SENSOR ARBOL DE LEVA FORD EXPLORER;AUTO.90;PZA;111;4.813;GA002-136.jpg;96;t;1;0;0;0;f
4345;GA002-137;PORTA FUSIBLE AT DE GOMA CON TAPA CABLE 12;AUTO.90;PZA;-4;1.453;GA002-137.jpg;96;t;1;0;1.051;0;f
4346;GA002-138;CONECTOR SENSOR OXIGENO CHEVR OPTRA TERMOSTATO AVEO;AUTO.90;PZA;191;2.082;GA002-138.jpg;96;t;1;0;0;0;f
4347;GA002-139;CONECTOR BOBINA CENTURY BLAZER CHEYENE DAEWOO (1 LADO);AUTO.90;PZA;82;2.199;GA002-139.jpg;96;t;1;0;0;0;f
4348;GA002-14;CONECTOR SENSOR TEMPERATURA G.M. (GAH02-18);AUTO.90;PZA;1;1.667;GA002-14.jpg;96;t;1;0;1.233;0;f
4349;GA002-140;PORTA FUSIBLE AT IVICA PFN-182;AUTO.90;PZA;60;0.905;GA002-140.jpg;96;t;1;0;0;0;f
4350;GA002-141;CONECTOR SENSOR TEMPERATURA EXPLORER COROLLA HILUX MERU 2P;AUTO.90;PZA;124;2.005;GA002-141.jpg;96;t;1;0;1.671;0;f
4351;GA002-142;CONECTOR BOMBA GASOLINA EXTERNA HYUNDAI KIA;AUTO.90;PZA;0;1.693;GA002-142.jpg;96;t;1;0;1.467;0;f
4352;GA002-15;CONECTOR INYECTOR G.M. CAVALIER/FIESTA (43-6167);AUTO.90;PZA;16;9.107;GA002-15.jpg;96;t;1;0;0;0;f
4353;GA002-16;CONECTOR REGULADOR CHRYSLER;AUTO.90;PZA;0;0;GA002-16.jpg;96;t;1;0;0;0;f
4354;GA002-17;CONECTOR DIODERA FORD 2G;AUTO.90;PZA;10;5.76;GA002-17.jpg;96;t;1;0;0;0;f
4355;GA002-18;GA002-130...SOCATE BOMBILLO 3156 1CONTACTOS 2 CABLES;AUTO.90;PZA;110;5.15;GA002-18.jpg;96;t;1;0;0;0;f
4356;GA002-21;CONECTOR ADAPT CS130 A10.12.27SI ETC;AUTO.90;PZA;0;2.653;GA002-21.jpg;96;t;1;0;0;0;f
4357;GA002-22;CONECTOR BOBINA CENTURY BLAZER CHEYENE DAEWOO (PAR);AUTO.90;PAR;65;2.4;GA002-22.jpg;96;t;1;0;0;0;f
4358;GA002-23;CONECTOR DISTRIBUIDOR GENERAL MOTOR MONZA BOSCH;AUTO.90;PZA;0;4.76;GA002-23.jpg;96;t;1;0;0;0;f
4359;GA002-24;CONECTOR RELE ELECTROVENTILADOR GM CHEVETE MALIBU IMPALA;AUTO.90;PZA;267;3.333;GA002-24.jpg;96;t;1;0;0;0;f
4360;GA002-25;CONECTOR BOMBA GASOLINA F.I. GENERAL MOTOR 3.1/2.8;AUTO.90;PZA;195;0.813;GA002-25.jpg;96;t;1;0;0.68;0;f
4361;GA002-26;CONECTOR AIRE ACONDICIONADO (COMPRESOR) Y RELE (BLOWER);AUTO.90;PZA;0;1.787;GA002-26.jpg;96;t;1;0;0;0;f
4362;GA002-27;ARNES PORTA BOMBILLO 9006 CERAMICA;AUTO.90;PZA;1;1.6;GA002-27.jpg;96;t;1;0;1.507;0;f
4363;GA002-28;CONECTOR VALVULA ACE G.M. 92/87;AUTO.90;PZA;190;1.973;GA002-28.jpg;96;t;1;0;1.64;0;f
4364;GA002-31;SOCATE TABLERO BOMBILLO 158 168 194 2 CONTACTO 5/8;AUTO.90;PZA;160;0.46;GA002-31.jpg;96;t;1;0;0;0;f
4365;GA002-32;ARNES PORTA FUSIBLE AT DE CERAMICA;AUTO.90;PZA;0;1.147;GA002-32.jpg;96;t;1;0;1.167;0;f
4366;GA002-33;PORTA FUSIBLE MAXI CON TAPA;AUTO.90;PZA;0;7.52;GA002-33.jpg;96;t;1;0;0;0;f
4367;GA002-33-1;PORTA FUSIBLE MAXI CON TAPA CABLE#10;AUTO.90;PZA;129;7.52;GA002-33-1.jpg;96;t;1;0;5.467;4.667;f
4368;GA002-33-2;PORTA FUSIBLE MAXI CON TAPA CABLE#8;AUTO.90;PZA;55;7.52;GA002-33-2.jpg;96;t;1;0;5.467;4.667;f
4369;GA002-34;PORTA FUSIBLE MINI;AUTO.90;PZA;0;0.893;GA002-34.jpg;96;t;1;0;0.8;0;f
4370;GA002-38;CONECTOR BOMBILLO H7 BAQUELITA SIN CABLE;AUTO.90;PZA;4;2.733;GA002-38.jpg;96;t;1;0;0;0;f
4371;GA002-41;CONECTOR PARA BOMBA GASOLINA TIPO BOSCH;AUTO.90;PZA;36;2.649;GA002-41.jpg;96;t;1;0;0;0;f
4372;GA002-43;CONECTOR ELECTRO VENTILADOR GM CORSA...GA002-64;AUTO.90;PZA;10;4.158;GA002-43.jpg;96;t;1;0;0;0;f
4373;GA002-44;CONECTOR BOBINA RENAULT MEGANE/KIA;AUTO.90;PZA;227;1.68;GA002-44.jpg;96;t;1;0;1.4;0;f
4374;GA002-45;CONECTOR REGULADOR IM 216 (ALTERNADOR FORD FESTIVA/HYUNDAI);AUTO.90;PZA;0;5.248;GA002-45.jpg;96;t;1;0;0;0;f
4375;GA002-46;CONECTOR SENSOR OXIGENO CHEVROLET OPTRA 2 PINES;AUTO.90;PZA;8;3.024;GA002-46.jpg;96;t;1;0;0;0;f
4376;GA002-47;SOCATE PARA BOMBILLO H7 CERAMICA;AUTO.90;PZA;115;1.48;GA002-47.jpg;96;t;1;0;0.72;0;f
4377;GA002-48;CONECTOR ELECTRO VENTILADOR JEEP CHEROKEE (LADO HEMBRA);AUTO.90;PZA;0;5.2;GA002-48.jpg;96;t;1;0;0;0;f
4378;GA002-50;CONECTOR VALVULA DE TEMPERATURA CHRYSLER/NEON/JEEP;AUTO.90;PZA;0;2.544;GA002-50.jpg;96;t;1;0;0;0;f
4379;GA002-51;CONECTOR INYECTOR GM/AVEO OPTRA;AUTO.90;PZA;5;2.572;GA002-51.jpg;96;t;1;0;0;0;f
4380;GA002-54;SOCATE METAL UNIVERSAL 2 CONTACTO SIN BASE;AUTO.90;PZA;169;0.736;GA002-54.jpg;96;t;1;0;0;0;f
4381;GA002-57;CONECTOR BOBINA CENTURY BLAZER CHEYENE DAEWOO (1 LADO);AUTO.90;PZA;0;1.2;GA002-57.jpg;96;t;1;0;0.867;0;f
4382;GA002-58;CONECTOR INYECTOR CORSA/FESTIVA/CIELO;AUTO.90;PZA;303;3.813;GA002-58.jpg;96;t;1;0;2.5;0;f
4383;GA002-59;CONECTOR REGULADOR ALTERNADOR FORD AVEO BLAZER CORSA OPTRA;AUTO.90;PZA;38;2.627;GA002-59.jpg;96;t;1;0;0;0;f
4384;GA002-60;CONECTORBOMBA DE GASOLINA /*ELECTRO;AUTO.90;PZA;0;2.592;GA002-60.jpg;96;t;1;0;0;0;f
4385;GA002-62;CONECTOR ELECTRO-VENTILADOR FIESTA ECOSPORT (GA001-04);AUTO.90;PZA;124;2.909;GA002-62.jpg;96;t;1;0;0;0;f
4386;GA002-63;CONECTOR ELECTRO VENTILADOR GM/AVEO;AUTO.90;PZA;10;2.98;GA002-63.jpg;96;t;1;0;0;0;f
4387;GA002-64;CONECTOR ELECTRO VENTILADOR GM CORSA...GA002-43;AUTO.90;PZA;-9;1.912;GA002-64.jpg;96;t;1;0;1.467;0;f
4388;GA002-66;CONECTOR INYECTOR NEON/CRYSLER;AUTO.90;PZA;160;2.15;GA002-66.jpg;96;t;1;0;1.8;0;f
4389;GA002-67;CONECTOR ELECTRO VENTILADOR NEON (LADO MACHO);AUTO.90;PZA;9;5.92;GA002-67.jpg;96;t;1;0;0;0;f
4390;GA002-68;CONECTOR ELECTRO VENTILADOR JEEP CHEROKEE COMPLETO;AUTO.90;PZA;0;8.573;GA002-68.jpg;96;t;1;0;0;0;f
4391;GA002-69;CONECTOR ELECTRO VENTIILADOR FORD;AUTO.90;PZA;10;5.984;GA002-69.jpg;96;t;1;0;0;0;f
4392;GA002-70;CONECTOR ELECTRO VENTIILADOR;AUTO.90;PZA;165;1.92;GA002-70.jpg;96;t;1;0;1.6;0;f
4393;GA002-71;CONECTOR INYECTOR TOYOTA;AUTO.90;PZA;125;2.092;GA002-71.jpg;96;t;1;0;1.744;0;f
4394;GA002-72;CONECTOR ELECTRONICO/VENT VW GOL;AUTO.90;PZA;0;1.853;GA002-72.jpg;96;t;1;0;0;0;f
4395;GA002-73;CONECTOR BOMBILLO 9005 CERAMICA;AUTO.90;PZA;253;2.227;GA002-73.jpg;96;t;1;0;0;0;f
4396;GA002-75;CONECTOR SOCATE BOMBILLO H8/H11 CERAMICA;AUTO.90;PZA;27;2.227;GA002-75.jpg;96;t;1;0;0;0;f
4397;GA002-76;CONECTOR VALVULA ELECTRO VENTILADOR SWIFT;AUTO.90;PZA;0;2.347;GA002-76.jpg;96;t;1;0;0;0;f
4398;GA002-78;CONECTOR BOBINA AVEO SPARK;AUTO.90;PZA;34;2.15;GA002-78.jpg;96;t;1;0;1.94;0;f
4399;GA002-80;SOCATE PORTABOBILLO 1 CONTACTO 1073;AUTO.90;PZA;0;2.307;GA002-80.jpg;96;t;1;0;0;0;f
4400;GA002-81;CONECTOR ALT FORD F250 F350 (CON-08157) ( SQ-484);AUTO.90;PZA;18;3.333;GA002-81.jpg;96;t;1;0;0;0;f
4401;GA002-82;CONECTOR INYECTOR CHEV CAVALIER Y FORD FIESTA (43-211);AUTO.90;PZA;73;0.92;GA002-82.jpg;96;t;1;0;0.76;0;f
4402;GA002-84;SOCATE PARA BOMBILLO 73 TABLERO S/CABLE (SOC-52056);AUTO.90;PZA;0;0.72;GA002-84.jpg;96;t;1;0;0;0;f
4403;GA003-01;CONECTOR BOBINA CAPTADORA;AUTO.90;PZA;0;1.373;GA003-01.jpg;96;t;1;0;0;0;f
4404;GA003-02;SOCATE PLANO DE GENERAL MOTOR 2 CONTACTO;AUTO.90;PZA;4;2.973;GA003-02.jpg;96;t;1;0;0;0;f
4405;GA003-03;CONECTOR CAMBIO DE LUZ DS5 FORD COUGA;AUTO.90;PZA;1;1.188;GA003-03.jpg;96;t;1;0;0;0;f
4406;GA003-04;CONECTOR CAMBIO DE LUZ DS7 G.M. MACK;AUTO.90;PZA;0;5.559;GA003-04.jpg;96;t;1;0;0;0;f
4407;GA003-042;CONECTOR SENSOR HYUNDAI 3 PINES F1-83A F1R (3);AUTO.90;PZA;10;2.733;GA003-042.jpg;96;t;1;0;0;0;f
4408;GA003-043;SOCATE METAL UNIVERSAL 2 CONTA F1R-1225 (3);AUTO.90;PZA;10;1.227;GA003-043.jpg;96;t;1;0;0;0;f
4409;GA003-044;SOCATE STOP BOMBILLO 3157 2CONTACTOS 3 CABLES;AUTO.90;PZA;0;4.293;GA003-044.jpg;96;t;1;0;0;0;f
4410;GA003-045;CONECTOR REDONDO 3 CABLES NPR SQ-12191 (3);AUTO.90;PZA;0;2.307;GA003-045.jpg;96;t;1;0;0;0;f
4411;GA003-046;CONECTOR METAL UNIVERSAL 2 CONTACTO F1R-999 (3);AUTO.90;PZA;5;1.693;GA003-046.jpg;96;t;1;0;0;0;f
4412;GA003-047;CONECTOR SENSOR TPSCARBURADOR SQ-312 (3);AUTO.90;PZA;5;2.173;GA003-047.jpg;96;t;1;0;0;0;f
4413;GA003-048;CONECTOR BOMBINA GM AVEO OPTRA SQ-911 (3);AUTO.90;PZA;33;2.187;GA003-048.jpg;96;t;1;0;1.467;0;f
4414;GA003-049;SOCATE STOP BOMBILLO 7443 DOBLE;AUTO.90;PZA;15;1.533;GA003-049.jpg;96;t;1;0;0;0;f
4415;GA003-05;SOCATE G.M. PARA BOMBILLO 1034;AUTO.90;PZA;10;1.987;GA003-05.jpg;96;t;1;0;0;0;f
4416;GA003-050;SOCATE METAL DOBLE BOMBILLO 1034 2 CONTACTOS C/CONECTOR;AUTO.90;PZA;5;2.947;GA003-050.jpg;96;t;1;0;0;0;f
4417;GA003-051;CONECTOR SENSOR CIGUENAL LEVA / BOBINA NEON;AUTO.90;PZA;0;5.573;GA003-051.jpg;96;t;1;0;0;0;f
4418;GA003-052;SOCATE METAL BOMBILLO 1034 DE 2 CONTACTO C/CONECTOR;AUTO.90;PZA;5;1.947;GA003-052.jpg;96;t;1;0;0;0;f
4419;GA003-053;CONECTOR 3 VIAS VALVULA IAC GM DAEWOO SENSOR TPS FIAT UNO;AUTO.90;PZA;85;1.667;GA003-053.jpg;96;t;1;0;1.467;0;f
4420;GA003-054;CONECTOR SENSOR 3 VIAS CIGUEÑAL AUDI A4 A3 A6 SEAT IBIZA CORDOBA LEON;AUTO.90;PZA;150;2.173;GA003-054.jpg;96;t;1;0;1.92;0;f
4421;GA003-055;CONECTOR PORTA BOMBILLO 9008/H13 PLASTICO;AUTO.90;PZA;0;4.417;GA003-055.jpg;96;t;1;0;0;0;f
4422;GA003-056;CONECTOR SOCATE H4 SILVIN HIGH HEAT AR-160HH IVICA;AUTO.90;PZA;271;2.9;GA003-056.jpg;96;t;1;0;1.933;0;f
4423;GA003-057;CONECTOR ALTERNADOR NUEVO COROLLA;AUTO.90;PZA;0;4;GA003-057.jpg;96;t;1;0;0;0;f
4424;GA003-06;SOCATE FORD BOMBILLO 1034 DE 2 CONTACTOS;AUTO.90;PZA;153;3.168;GA003-06.jpg;96;t;1;0;0;0;f
4425;GA003-07;CONECTOR BOBINA FORD BRONCO DG434;AUTO.90;PZA;31;6.624;GA003-07.jpg;96;t;1;0;0;0;f
4426;GA003-08;CONECTOR PRESION AIRE ACONDICIONADO CHEVROLET 3 PINES MACHO RANURA LADO;AUTO.90;PZA;0;3.904;GA003-08.jpg;96;t;1;0;0;0;f
4427;GA003-09;CONECTOR ALTERNADOR GENERAL MOTOR CENTURY F.I. CS130;AUTO.90;PZA;0;4.373;GA003-09.jpg;96;t;1;0;0;0;f
4428;GA003-11;CONECTOR SENSOR AIRE MASS G.M. 85/96;AUTO.90;PZA;10;2.48;GA003-11.jpg;96;t;1;0;0;0;f
4429;GA003-12;CONECTOR SENSOR MAP CHEVROLET 3 PINES MACHO RANURA ABAJO;AUTO.90;PZA;1;3.488;GA003-12.jpg;96;t;1;0;0;0;f
4430;GA003-14;CONECTOR SENSOR VELOCIDAD MINIMA G.M. GRIS;AUTO.90;PZA;0;2.68;GA003-14.jpg;96;t;1;0;0;0;f
4431;GA003-15;CONECTOR REGULADOR FORD 2G/3G;AUTO.90;PZA;5;6.96;GA003-15.jpg;96;t;1;0;0;0;f
4432;GA003-16;ARNES PORTA BOMBILLO 9004-9007 DE CERAMICA;AUTO.90;PZA;79;1.693;GA003-16.jpg;96;t;1;0;0;0;f
4433;GA003-17;ARNES PORTA BOMBILLO SEAL BEAM (H4) DE CERAMICA;AUTO.90;PZA;359;1.405;GA003-17.jpg;96;t;1;0;1.307;0;f
4434;GA003-18;CONECTOR ADAPTADOR ALTERNADOR TOYOTA 2 CONTACTOS;AUTO.90;PZA;0;2.973;GA003-18.jpg;96;t;1;0;0;0;f
4435;GA003-19;CONECTOR ADAPTADOR ALTERNADOR NIPPON/ MITSUBISHI 3 CONTACTO;AUTO.90;PZA;1;3.027;GA003-19.jpg;96;t;1;0;0;0;f
4436;GA003-21;CONECTOR ALTERNADOR TOYOTA COROLLA 3 CABLES;AUTO.90;PZA;-5;3.795;GA003-21.jpg;96;t;1;0;0;0;f
4437;GA003-22;CONECTOR REGULADOR ALTERNADOR FIESTA;AUTO.90;PZA;75;3.451;GA003-22.jpg;96;t;1;0;0;0;f
4438;GA003-23;CONECTOR SENSOR MAP CORSA/CIELO/LANOS 3 PINES;AUTO.90;PZA;0;3.413;GA003-23.jpg;96;t;1;0;0;0;f
4439;GA003-24;CONECTOR ELECTRO VENTILADOR VW;AUTO.90;PZA;0;4.752;GA003-24.jpg;96;t;1;0;0;0;f
4440;GA003-25;CONECTOR SENSOR BOBINA TPS FORD FIESTA/KA;AUTO.90;PZA;0;4.2;GA003-25.jpg;96;t;1;0;0;0;f
4441;GA003-27;CONECTOR ELECTROVENTILADOR OPTRA/BLAZER/VEPTRA/CORSA 1.8;AUTO.90;PZA;-1;3.568;GA003-27.jpg;96;t;1;0;0;0;f
4442;GA003-33;CONECTOR PORTA BOMBILLO 9008/H13 CERAMICA;AUTO.90;PZA;3;4.44;GA003-33.jpg;96;t;1;0;3.573;0;f
4443;GA003-37;CONECTOR ELECTRO VENTILADOR STEEM C-740;AUTO.90;PZA;8;2.56;GA003-37.jpg;96;t;1;0;0;0;f
4444;GA003-38;CONECTOR 3 VIAS IAC HYUNDAI ACCENT GETZ ELANTRA TUCSON KIA RIO;AUTO.90;PZA;0;2.173;GA003-38.jpg;96;t;1;0;1.92;0;f
4445;GA003-39;CONECTOR BOBINA CHEVROLET STEEM GRAND VITARA JIMMY;AUTO.90;PZA;68;1.68;GA003-39.jpg;96;t;1;0;1.4;0;f
4446;GA003-40;SOCATE PORTABOMBILLO 2 CONTACTOS ( SC-141/200);AUTO.90;PZA;230;2.893;GA003-40.jpg;96;t;1;0;0;0;f
4447;GA003-41;CONECTOR DE SENSOR TPS FORD EXPLORER AÑOS 98 AL 05;AUTO.90;PZA;10;4.405;GA003-41.jpg;96;t;1;0;0;0;f
4448;GAH01-01;CONECTOR VALVULA TEMPERATURA TABLERO AVEO OPTRA CORSA CIELO;AUTO.90;PZA;604;0.229;GAH01-01.jpg;96;t;1;0;0.317;0;f
4449;GAH01-02;CONEXION TIERRA;AUTO.90;PZA;49;0.215;GAH01-02.jpg;96;t;1;0;0.304;0;f
4450;GAH01-03;CONECTOR VALVULA TEMPERATURA TABLERO FORD FESTIVA TURPIAL KIA RIO;AUTO.90;PZA;0;0.257;GAH01-03.jpg;96;t;1;0;0.224;0;f
4451;GAH02-01;PORTA FUSIBLE DE NYLON AT C/CABLE AWG 16;AUTO.90;PZA;0;0.815;GAH02-01.jpg;96;t;1;0;0.627;0;f
4452;GAH02-02;PORTA FUSIBLE AT NYLON C/CABLE AWG 14;AUTO.90;PZA;-22;0.905;GAH02-02.jpg;96;t;1;0;0.604;0;f
4453;GAH02-03;ARNES PORTA-FUSIBLE AT (14AM TB250..);AUTO.90;PZA;0;0;GAH02-03.jpg;96;t;1;0;0;0;f
4454;GAH02-04;ARNES PORTA-FUSIBLE CILINDRICO BAKELITA NEGRO (14AM);AUTO.90;PZA;192;1;GAH02-04.jpg;96;t;1;0;0.747;0;f
4455;GAH02-05;ARNES PORTA FUSIBLE CILINDRICO P.P. BLANCO (18RJ);AUTO.90;PZA;9;0.189;GAH02-05.jpg;96;t;1;0;0;0;f
4456;GAH02-06;SOCATE PARA BOMBILLO 73;AUTO.90;PZA;1038;0.599;GAH02-06.jpg;96;t;1;0;0;0;f
4457;GAH02-07;CONECTOR 2 VIAS (L) SOCATE FLASHER UNIVERSAL;AUTO.90;PZA;815;0.273;GAH02-07.jpg;96;t;1;0;0;0;f
4458;GAH02-09;PORTA BOMBILLO 158 T10;AUTO.90;PZA;-20;1.12;GAH02-09.jpg;96;t;1;0;0.64;0;f
4459;GAH02-11;CONECTOR PARA INYECTOR GENERAL MOTOR;AUTO.90;PZA;-13;1.34;GAH02-11.jpg;96;t;1;0;0.893;0;f
4460;GAH02-14;PORTA FUSIBLE AT NYLON CABLE AWG 12 (SIN FUSIBLE);AUTO.90;PZA;40;1.057;GAH02-14.jpg;96;t;1;0;0.705;0;f
4461;GAH02-16;CONECTOR SENSOR EGR DE AVEO/OPTRA/NUBIRA;AUTO.90;PZA;0;1.156;GAH02-16.jpg;96;t;1;0;0;0;f
4462;GAH02-17;CONECTOR FARO DE CORSA;AUTO.90;PZA;386;0.917;GAH02-17.jpg;96;t;1;0;0;0;f
4463;GAH02-24;CONECTOR REGULADOR CHEVROLET CON REGULADOR DE VOLTAGE EXTERNO AÑO 1974;AUTO.90;PZA;95;0.701;GAH02-24.jpg;96;t;1;0;0;0;f
4464;GAH02-25;ARNES PORTA BOMBILLO 158;AUTO.90;PZA;0;1.12;GAH02-25.jpg;96;t;1;0;0.64;0;f
4465;GAH02-28;CONECTOR SOCATE BOMBILLO H9-H11 NYLON66 HEAVY DUTY;AUTO.90;PZA;10;4.32;GAH02-28.jpg;96;t;1;0;2.52;0;f
4466;GAH02-29;PORTA FUSIBLE AT NYLON 40AMP CABLE10;AUTO.90;PZA;-20;2.4;GAH02-29.jpg;96;t;1;0;1.267;0;f
4467;GAH03-01;CONECTOR SOCATE H4 SILVIN HIGH HEAT AR-160 HH IVICA;AUTO.90;PZA;0;2.9;GAH03-01.jpg;96;t;1;0;1.933;0;f
4468;GAH03-02;CONECTOR-ARNES PARA BOMBILLO 9004;AUTO.90;PZA;0;1.35;GAH03-02.jpg;96;t;1;0;1.042;0;f
4469;GAH03-021;CONECTOR BOBINA CAPTADORA VW GOL PARATI SAVERIO JETTA;AUTO.90;PZA;3;2.16;GAH03-021.jpg;96;t;1;0;0;0;f
4470;GAH03-022;CONECTOR SOCATE H4 EXTENSOR CABLE 14 20CM;AUTO.90;PZA;0;5.2;GAH03-022.jpg;96;t;1;0;1.804;0;f
4471;GAH03-023;CONECTOR SOCATE H4 DERIVAVCION A 2 FOCOS;AUTO.90;PZA;0;5.2;GAH03-023.jpg;96;t;1;0;1.804;0;f
4472;GAH03-04;ARNES SOCATE DE SILVIN (AWG 16);AUTO.90;PZA;0;1.733;GAH03-04.jpg;96;t;1;0;0;0;f
4473;GAH03-05;CONECTOR ALTERNADOR TOYOTA COROLLA 3 VIA;AUTO.90;PZA;986;0.405;GAH03-05.jpg;96;t;1;0;0;0;f
4474;GAH03-06;CONECTOR SOCATE PLANO BOMBILLO H4 SILVIN (AWG 16);AUTO.90;PZA;244;0.416;GAH03-06.jpg;96;t;1;0;0;0;f
4475;GAH03-07;CONECTOR SOCATE PLANO BOMBILLO H4 SILVIN (AWG 14);AUTO.90;PZA;932;1.52;GAH03-07.jpg;96;t;1;0;1.296;0;f
4476;GAH03-09;CONECTOR SOCATE PLANO C/TAPA BOMBILLO H4 SILVIN (AWG 14);AUTO.90;PZA;0;1.52;GAH03-09.jpg;96;t;1;0;1.296;0;f
4477;GAH03-20;CONECTOR SENSOR DE VELOCIDAD GM FIAT CORSA LANOS;AUTO.90;PZA;56;2.56;GAH03-20.jpg;96;t;1;0;0;0;f
4478;GAH04-04;CONECTOR RELE BOMBA GASOLINA MOTOVENTILADOR TSURU NISSAN 4 PINES;AUTO.90;PZA;10;3.828;GAH04-04.jpg;96;t;1;0;3.267;0;f
4479;GAH04-05;CONECTOR RELE BOMBA ACEITE DE VENTILADOR NISSAN CEFIRO SYLPHY TRAIL TEANA 4 PINES;AUTO.90;PZA;0;3.04;GAH04-05.jpg;96;t;1;0;0;0;f
4480;GAH05-02;PORTA RELE 5 PINES (2*12+3*18);AUTO.90;PZA;-200;3.16;GAH05-02.jpg;96;t;1;0;1.467;0;f
4481;GAH05-08;CONECTOR SUBE VIDRIOS 5 PINES UNIVERSAL;AUTO.90;PZA;24;2.56;GAH05-08.jpg;96;t;1;0;0;0;f
4482;GAH05-09;PORTA RELE 5 PINES (2*14+3*18);AUTO.90;PZA;-197;3.16;GAH05-09.jpg;96;t;1;0;1.307;0;f
4483;GAH05-10;PORTA-RELE 5 PINES CERAMICA C/CONECTOR (2X14+3X18);AUTO.90;PZA;0;3.16;GAH05-10.jpg;96;t;1;0;2.107;1.599;f
4484;GAH06-03;CONECTOR RELE 6 PINES NISSAN D21 SENTRA FRONTIER;AUTO.90;PZA;0;3.84;GAH06-03.jpg;96;t;1;0;0;0;f
4485;GAS01-01;CONECTOR 1 VIA SET HEMBRA-MACHO PLANO 250;AUTO.90;PZA;-27;0.711;GAS01-01.jpg;96;t;1;0;0.284;0;f
4486;GAS01-02;CONECTOR 1 VIA SET HEMBRA-MACHO CILINDRICO 2.0;AUTO.90;PZA;0;0.288;GAS01-02.jpg;96;t;1;0;0;0;f
4487;GAS01-03;CONECTOR 1 VIA SET HEMBRA-MACHO PLANO 312;AUTO.90;PZA;18;1.991;GAS01-03.jpg;96;t;1;0;0.893;0;f
4488;GAS02-01;CONECTOR 2 VIA SET HEMBRA-MACHO PLANO 250;AUTO.90;PZA;0;0.969;GAS02-01.jpg;96;t;1;0;0.647;0;f
4489;GAS02-02;CONECTOR 2 VIA SET HEMBRA-MACHO CILINDRICO 2.0;AUTO.90;PZA;35;1.433;GAS02-02.jpg;96;t;1;0;0.955;0;f
4490;GAS02-03;CONECTOR 2 VIA SET HEMBRA-MACHO PLANO CABLE 12;AUTO.90;PZA;12;2.56;GAS02-03.jpg;96;t;1;0;2.04;0;f
4491;GAS02-04;CONECTOR 2 VIA SET HEMBRA-MACHO PLANO 250 C/OREJAS;AUTO.90;PZA;23;2.667;GAS02-04.jpg;96;t;1;0;0;0;f
4492;GAS02-05;CONECTOR 2 VIA CABLE AWG14 SET HEMBRA-MACHO CILINDRICO 2.0;AUTO.90;PZA;-30;1.951;GAS02-05.jpg;96;t;1;0;1.04;0;f
4493;GAS02-06;CONECTOR 2 VIA SET HEMBRA-MACHO PLANO CABLE 14;AUTO.90;PZA;-20;1.607;GAS02-06.jpg;96;t;1;0;1.397;0;f
4494;GAS02-07;CONECTOR HEMBRA-MACHO PLANO 250 AWG16 2 VIAS;AUTO.90;PZA;0;1.547;GAS02-07.jpg;96;t;1;0;0.947;0;f
4495;GAS02-08;CONECTOR 2 VIAS ANDERSON CABLE 10;AUTO.90;PZA;0;4.999;GAS02-08.jpg;96;t;1;0;4.499;0;f
4496;GAS02-09;CONECTOR 2 VIAS ANDERSON CABLE 12;AUTO.90;PZA;0;4.06;GAS02-09.jpg;96;t;1;0;3.69;0;f
4497;GAS02-10;CONECTOR 2 VIAS ANDERSON CABLE 8;AUTO.90;PZA;0;5.999;GAS02-10.jpg;96;t;1;0;5.399;0;f
4498;GAS02-11;ARNES ANDERSON C/FUSILERA CABLE 10;AUTO.90;PZA;0;12.9;GAS02-11.jpg;96;t;1;0;7.74;0;f
4499;GAS02-12;ARNES ANDERSON C/FUSILERA CABLE 8;AUTO.90;PZA;0;14.2;GAS02-12.jpg;96;t;1;0;12.9;0;f
4500;GAS03-01;CONECTOR 3 VIA SET HEMBRA-MACHO PLANO 250;AUTO.90;PZA;15;3.328;GAS03-01.jpg;96;t;1;0;1.812;0;f
4501;GAS03-02;CONECTOR 3 VIA SET HEMBRA-MACHO CILINDRICO 2.0;AUTO.90;PZA;-11;2.16;GAS03-02.jpg;96;t;1;0;1.653;0;f
4502;GAS03-04;CONECTOR 3 VIA SET HEMBRA-MACHO CILINDRICO 2.0AWG 14;AUTO.90;PZA;13;2.173;GAS03-04.jpg;96;t;1;0;0.879;0;f
4503;GAS03-05;CONECTOR HEMBRA-MACHO PLANO 250 AWG16 3 VIAS;AUTO.90;PZA;0;2.52;GAS03-05.jpg;96;t;1;0;1.547;0;f
4504;GAS04-01;CONECTOR 4 VIAS SET HEMBRA-MACHO PLANO 250;AUTO.90;PZA;0;4.067;GAS04-01.jpg;96;t;1;0;2.852;0;f
4505;GAS04-02;CONECTOR 4 VIAS SET HEMBRA-MACHO CILINDRICO 2.0;AUTO.90;PZA;30;1.451;GAS04-02.jpg;96;t;1;0;0.86;0;f
4506;GAS04-03;CONECTOR 4 VIAS SET HEMBRA-MACHO CILINDRICO 2.0 AWG14;AUTO.90;PZA;-10;4.333;GAS04-03.jpg;96;t;1;0;2.013;0;f
4507;GAS04-04;CONECTOR 4 VIAS HEMBRA-MACHO PLANO 250 CABLE#16;AUTO.90;PZA;0;2.813;GAS04-04.jpg;96;t;1;0;1.733;0;f
4508;GAS04-05;CONECTOR 4 VIAS HEMBRA-MACHO PLANO CABLE#14;AUTO.90;PZA;-50;4.8;GAS04-05.jpg;96;t;1;0;2.7;0;f
4509;GAS06-01;CONECTOR 6 VIAS SET HEMBRA-MACHO PLANO 250;AUTO.90;PZA;0;4.075;GAS06-01.jpg;96;t;1;0;3.607;0;f
4510;GAS06-04;CONECTOR 6 VIAS SET HEMBRA-MACHO PLANO 250 AWG14;AUTO.90;PZA;0;5.053;GAS06-04.jpg;96;t;1;0;2.693;0;f
4511;GAS08-01;CONECTOR 8 VIA SET HEMBRA-MACHO PLANO 250;AUTO.90;PZA;-5;4.833;GAS08-01.jpg;96;t;1;0;3.407;0;f
4512;GAS09-01;CONECTOR 9 VIA SET HEMBRA-MACHO CILINDRICO 2.0;AUTO.90;PZA;-5;5.173;GAS09-01.jpg;96;t;1;0;3.453;0;f
4513;GAS11-01;CONECTOR 11 VIAS SET HEMBRA-MACHO PLANO 250;AUTO.90;PZA;0;6.587;GAS11-01.jpg;96;t;1;0;5.091;0;f
4514;GAS12-01;CONECTOR 12 VIA SET HEMBRA-MACHO CILINDRICO 2.0;AUTO.90;PZA;-5;6.933;GAS12-01.jpg;96;t;1;0;4.653;0;f
4515;GAS15-01;CONECTOR 15 VIA SET HEMBRA-MACHO CILINDRICO 2.0;AUTO.90;PZA;20;4.6;GAS15-01.jpg;96;t;1;0;5.657;0;f
